Product ID,Description,Manufacturer,Warranty,Material
1075,Decide hold program represent. Catch him ahead wife poor sense. Marriage those treatment page action travel. Born ten may official look weight impact senior.,Henson LLC,2 years,wife
1033,How end teach political attack. Back short open development become.,Collins-Thomas,1 years,class
1082,"Light upon Congress discussion ball recognize. Continue we Republican continue although. Sound college until.
Find figure newspaper protect hand. Camera really down life skin old.","Best, Ray and Hill",1 years,forward
1026,"Under discover town protect easy color toward.
Consider nearly develop through win. Capital source culture course.",Leonard and Sons,1 years,summer
1077,"With next describe side return. Impact raise evening their hour role.
Smile toward coach area. Network minute prove what west.",Webb-Hudson,2 years,also
1048,"Accept movie least democratic. Recognize other ball agreement want. Gun eye improve than standard.
Cost model prove moment somebody issue recent.",Webb-Orozco,1 years,staff
1064,"Similar from yes marriage. Between will civil civil because force now on.
Three perform tree eat three. Organization top all product. Evening lay something.",Bell Ltd,1 years,find
1066,"Half boy type however we successful news.
Include rich myself. While country series cultural. Best who mouth four. Black dream agency significant.","Richards, Myers and Lopez",2 years,try
1058,"Themselves study speech man camera. Forward matter real out important great.
Oil water coach why room system. Husband quality ago bar point.",Allen-Orr,1 years,know
1091,"Each five reality draw must care capital. Summer Mr child find.
Chair benefit against side loss able. We never theory senior scientist over experience. Idea amount look father.",Washington-Pugh,1 years,next
1021,"Knowledge response be it. Professor play available enjoy deep attention ok. Decade beyond relate order.
Candidate board collection red. A top bring.",Caldwell PLC,2 years,garden
1026,"What fund cup young field institution look. Establish newspaper return result since. General parent receive clear must develop.
Whose discuss which wrong business. Stay reveal in forward must risk.",Alexander-Henderson,2 years,public
1014,Life station administration film just win cold hair. Dog there end eat determine. Onto bar budget sport want impact station base. Ok realize government know media and.,Munoz-Santos,1 years,raise
1023,Which answer focus section Mr sound easy both. Tax international realize lot foreign. Whole perhaps pretty range. Off avoid edge series finally something question.,Gill PLC,1 years,today
1074,Campaign teacher knowledge hold ability attack. Truth computer be good great sell catch. Draw value water story pay yourself available.,Cohen Group,1 years,safe
1039,"While discuss sell order. Investment up true that story three.
Ask foot evidence late major. Box effort if keep. Owner official agree pass.
Degree level gas expect.",Tran-Hughes,1 years,moment
1050,"Certainly hospital tough scientist. Form poor change forward himself. Fast push represent trouble thus life.
Beautiful toward imagine history. Cultural from performance at data number check.",Reed-Collins,1 years,create
1063,"Too dinner me century your. Remember tough political or.
Rich herself sure. Smile dream I positive smile entire. Either stock large morning next least range.",Aguilar and Sons,2 years,door
1040,Phone maybe laugh. Computer positive side red. Military use likely so.,Smith Inc,2 years,several
1050,"Peace possible new assume. Base pick majority old relationship hard. Share world science claim expert back.
Machine exactly yeah statement none. Game cut why whether heavy.","Snow, Wilson and Thomas",1 years,recently
1047,College story fire situation significant. Stop a anyone lot husband. Sound finish agree fall executive nor. Choose find model yet some hot manager.,Jackson-Miller,2 years,five
1066,"Only fight often employee speak approach bar. Involve born take him another will.
Strong task sing concern often. Nor foreign simple name interview make red. Especially kitchen ground small.",Heath-Gomez,1 years,best
1048,Moment get mouth voice save window form. But be service her use example behind bar. Move from apply tough film.,Thomas Inc,1 years,entire
1015,"Stay least should letter voice fight believe theory. Knowledge green require.
Blood surface as brother former him responsibility. She arrive law professional visit final discussion.","Taylor, Gomez and Reynolds",1 years,act
1023,Town present member rest fear body material mind. Economic election bag rise give writer color. Drive forward task cup.,"Lewis, Greer and Baker",1 years,course
1068,"Degree media stand child. Tree sing exactly part great wall picture.
Table network town election glass action thousand. Thank hour one party he.",Burgess Ltd,2 years,about
1048,"Attention something edge stage there. Sea decision during couple stand type mention whether.
Worker reveal admit so total debate already first. Edge before next. Occur effort above benefit.",Mills-Pena,2 years,safe
1099,"Than imagine hospital almost ball realize home. Cost assume three father face hair. Decide write reflect Mr those past.
Sense some take. Manager short measure.",Thomas LLC,2 years,law
1059,Loss share program soldier with. Floor success think coach social. Economy foot newspaper office stand memory tough.,Gonzales-Norris,2 years,check
1082,"Kid government arrive option fear production. Actually Mrs investment whether.
Report kind station recently career there effect.","Jackson, Mathis and Gonzales",1 years,hand
1001,"Part indicate goal final data color. Itself although reflect beyond image seek mean.
As happy billion organization group process. Quickly sell dream form offer.","Cordova, Rich and Brown",1 years,how
1004,"Century economy list policy. Light firm either new per cover. Exactly democratic if.
Stay rule save opportunity. Modern opportunity college ready heavy vote week recently.",Oconnell Inc,1 years,produce
1049,Big near network. We get professor continue right type century. Difficult positive think describe wear.,Irwin PLC,1 years,sense
1096,General wrong rich more image hear father. From act else heavy catch card. Law add production this source mind hundred that.,Davis PLC,2 years,though
1032,"Cause just alone window.
Either room crime officer. Stage in check true. Crime carry miss.
Religious call heavy six no city fire. South democratic eight agreement all.",Hale and Sons,2 years,most
1081,Billion old certainly kind. Build box type above control threat. Deal eye care likely edge finish task.,Nguyen-Phillips,1 years,cost
1081,"Manage music sure remember high administration. Break Democrat different someone those.
Share determine available dark number. Local people thus black. Trip deep through.",Johnson-Jacobs,1 years,establish
1027,"Way same stuff suffer most customer court. Student account garden employee.
Office star include cut station these.","Robinson, Hendrix and Martinez",1 years,check
1033,"Of model them method. Up issue back too. Fight there old debate.
Feel him college include senior floor find. Change five improve through radio.",Powell-Sims,2 years,rule
1015,"Seek film simply different professional. Time simply training dream man. Special rule hope wonder key current.
Trial direction top building. She score general yet industry answer.",Hull Inc,2 years,another
1048,Safe consider manage information cold serious. Cultural week call. Entire pick language hour computer appear. Eat church child politics board bit.,"Gonzalez, Weaver and Hayes",2 years,large
1060,"Often avoid present. House color then wish. Current treat choice individual.
Light number involve campaign send heart as. On account community trade rich hope benefit. Light man that.",Reed-Romero,2 years,hear
1052,Book foreign station forget particular another option. Smile born risk rather happen figure successful. Natural development American.,Smith LLC,1 years,truth
1019,Three present tree eye Democrat rich yeah. Lose history also mother response stage executive. Or ahead far car add risk.,"Dillon, Smith and Rocha",2 years,responsibility
1060,"Forward mention buy minute national artist she. Street listen billion example light design stop. Same who walk network personal.
Chair simply rule fish leg. Item special social list.","Clark, Mitchell and Thompson",1 years,yourself
1019,Others finally federal attack discussion same suddenly. Admit family kind resource loss capital billion. Make maintain time game probably meeting allow sell. Say important now catch over why seek.,Crane Group,2 years,defense
1074,"Long bank thus. Within work above. Rest special eat would doctor. Another charge idea area push.
Southern station song political maybe. Far nor call base indicate serve. A least wall director.",Ellison-Powell,1 years,piece
1060,"Partner pull police. Though follow involve red. Power beyond ask brother garden. Hit sort teacher body media.
Center assume news skin speech. Large large tree heavy upon institution age.",Palmer-Hull,1 years,both
1054,Feeling stay amount forget continue. Computer explain by million improve writer generation. Onto hope main huge.,Russell Inc,1 years,statement
1008,Health exist agreement. Better area possible Mrs perform kid cold key. Clearly worry performance our fill significant form once. Down character fine drop child.,Wilson-Khan,2 years,similar
1008,"Health event rule. Industry paper evening cultural couple. Low our west last.
It every alone allow. Common network perhaps pass time business economic.","Gonzalez, Johnson and Freeman",1 years,half
1033,"Nation gas current event crime most. Allow fund game discover break.
After sound effort response region. Day face herself edge guy when. Citizen enough walk learn himself.",Palmer-Haynes,2 years,box
1029,"Try analysis decade recently field. Effect onto various method think. Consumer of perform police. Tonight land collection bag while.
Garden throw tend policy step instead.",James Group,2 years,than
1065,Consumer authority bank billion however fight arrive. Right partner season campaign write machine.,Clark Group,2 years,their
1070,"Mr down I quickly kind organization born. Local among music somebody vote. Identify blue stay peace radio. Prevent help production right.
Fish at sport. Any job within. Million front good American.",Montgomery-Kline,2 years,officer
1009,"Understand drug standard between contain land. Think director parent can environment no.
Low control audience less number. Smile that perform situation.",Cunningham-May,2 years,participant
1006,"Analysis factor exactly interesting. Later bed let case.
Across so get from. Relate tax agency let.",Cooper-Lopez,2 years,performance
1038,"High president yes feel crime shake soon eight. Attack anything standard character last.
Especially away five too. Anyone property type can. Care capital around which your challenge area minute.",Allen-Murphy,2 years,institution
1010,Plant early student fear official peace child. Return on suggest action you. Blood high sometimes commercial laugh use.,Barnes-West,2 years,car
